{
  "$schema": "http://json-schema.org/draft-07/schema#",
  "title": "Blueprint Schema",
  "description": "Schema xác thực cho tệp bản vẽ thiết kế blueprint.json thuộc Stage 1 (Architect)",
  "type": "object",
  "required": ["$schema", "metadata", "static_structure", "dynamic_behavior", "interaction_points", "mitigation_map"],
  "additionalProperties": false,
  "properties": {
    "$schema": {
      "type": "string",
      "format": "uri"
    },
    "metadata": {
      "type": "object",
      "required": ["skill_name", "version", "architect_timestamp"],
      "additionalProperties": false,
      "properties": {
        "skill_name": {
          "type": "string",
          "pattern": "^[a-z0-9-]+$"
        },
        "version": {
          "type": "string",
          "pattern": "^[0-9]+\\.[0-9]+\\.[0-9]+$"
        },
        "architect_timestamp": {
          "type": "string",
          "format": "date-time"
        }
      }
    },
    "static_structure": {
      "type": "object",
      "required": ["folder_structure"],
      "additionalProperties": false,
      "properties": {
        "folder_structure": {
          "type": "array",
          "minItems": 3,
          "items": {
            "type": "object",
            "required": ["file_path", "zone", "role_description"],
            "additionalProperties": false,
            "properties": {
              "file_path": {
                "type": "string"
              },
              "zone": {
                "type": "string",
                "enum": ["core", "knowledge", "scripts", "templates", "data", "loop", "assets", "_shared"]
              },
              "role_description": {
                "type": "string",
                "minLength": 10
              }
            }
          }
        }
      }
    },
    "dynamic_behavior": {
      "type": "array",
      "minItems": 1,
      "items": {
        "type": "object",
        "required": ["flow_name", "description", "sequence_steps"],
        "additionalProperties": false,
        "properties": {
          "flow_name": {
            "type": "string",
            "minLength": 5
          },
          "description": {
            "type": "string",
            "minLength": 15
          },
          "sequence_steps": {
            "type": "array",
            "minItems": 2,
            "items": {
              "type": "object",
              "required": ["step_number", "actor", "action", "expected_result"],
              "additionalProperties": false,
              "properties": {
                "step_number": {
                  "type": "integer",
                  "minimum": 1
                },
                "actor": {
                  "type": "string"
                },
                "action": {
                  "type": "string",
                  "minLength": 5
                },
                "expected_result": {
                  "type": "string",
                  "minLength": 5
                }
              }
            }
          }
        }
      }
    },
    "interaction_points": {
      "type": "array",
      "items": {
        "type": "object",
        "required": ["point_id", "stage", "description", "require_user_approval"],
        "additionalProperties": false,
        "properties": {
          "point_id": {
            "type": "string",
            "pattern": "^IP-[0-9]+$"
          },
          "stage": {
            "type": "string"
          },
          "description": {
            "type": "string",
            "minLength": 10
          },
          "require_user_approval": {
            "type": "boolean"
          }
        }
      }
    },
    "mitigation_map": {
      "type": "array",
      "items": {
        "type": "object",
        "required": ["threat_id", "implemented_in_zone", "implementation_strategy"],
        "additionalProperties": false,
        "properties": {
          "threat_id": {
            "type": "string"
          },
          "implemented_in_zone": {
            "type": "string",
            "enum": ["core", "knowledge", "scripts", "templates", "data", "loop", "assets"]
          },
          "implementation_strategy": {
            "type": "string",
            "minLength": 15
          }
        }
      }
    }
  }
}
