{
  "$schema": "../_shared/schemas/blueprint.json",
  "metadata": {
    "skill_name": "skill-architect",
    "version": "2.0.0",
    "architect_timestamp": "2026-05-27T02:15:30Z"
  },
  "static_structure": {
    "folder_structure": [
      {
        "file_path": "SKILL.md",
        "zone": "core",
        "role_description": "File L0 Anchor điều hướng chính, định hình Persona của Architect, chứa frontmatter YAML và Boot Sequence nguyên tử."
      },
      {
        "file_path": "policy/workflow.md",
        "zone": "knowledge",
        "role_description": "Tài liệu chính sách mô tả chi tiết quy trình 3 Phase thiết kế từ exploration.json sang blueprint.json."
      },
      {
        "file_path": "policy/guardrails.md",
        "zone": "knowledge",
        "role_description": "Các ràng buộc an toàn kỹ thuật, chống lừa đảo hoàn thành (shortcut completion) và hướng dẫn kiểm soát chất lượng."
      },
      {
        "file_path": "policy/output-spec.md",
        "zone": "knowledge",
        "role_description": "Đặc tả kỹ thuật nghiêm ngặt quy định định dạng và các trường bắt buộc của tệp đầu ra blueprint.json."
      },
      {
        "file_path": "knowledge/architect.md",
        "zone": "knowledge",
        "role_description": "Tri thức chuyên sâu phân tích 3 Pillars cốt lõi (Core logic, Domain knowledge, Quality Loop)."
      },
      {
        "file_path": "knowledge/visualization-guidelines.md",
        "zone": "knowledge",
        "role_description": "Quy tắc thiết kế sequence flowcharts động và biểu diễn trực quan cấu trúc hệ thống."
      },
      {
        "file_path": "knowledge/design-exemplars.md",
        "zone": "knowledge",
        "role_description": "Tập hợp các ví dụ Good/Bad thực tế về thiết kế blueprint để AI học hỏi và phòng vệ lỗi."
      },
      {
        "file_path": "loop/design-checklist.md",
        "zone": "loop",
        "role_description": "Chốt chặn chất lượng kiểm soát toàn diện thiết kế trước khi chuyển giao sang Stage 2 Planner."
      }
    ]
  },
  "dynamic_behavior": [
    {
      "flow_name": "Architecting Blueprint Flow",
      "description": "Quy trình tuần tự của Architect để thiết kế hệ thống tĩnh, động và tạo bản vẽ blueprint.json an toàn thực chất.",
      "sequence_steps": [
        {
          "step_number": 1,
          "actor": "Architect",
          "action": "Đọc exploration.json và criteria.json từ .skill-context/{skill-name}/.",
          "expected_result": "Nạp thành công toàn bộ nghiệp vụ, rủi ro và tiêu chí chất lượng đầu vào sạch."
        },
        {
          "step_number": 2,
          "actor": "Architect",
          "action": "Phân tích và quy hoạch 7 Zones tĩnh cho các tệp vật lý của skill mới.",
          "expected_result": "Thiết lập danh sách static_structure sạch, không chứa tên file placeholder."
        },
        {
          "step_number": 3,
          "actor": "Architect",
          "action": "Thiết kế các kịch bản sequence logic động cho dynamic_behavior và Interaction Points.",
          "expected_result": "Hoàn thành sequence flow và các chốt chặn kiểm duyệt của Steve."
        },
        {
          "step_number": 4,
          "actor": "Architect",
          "action": "Lập mitigation_map liên kết các rủi ro bảo mật với phương án khắc phục tại từng Zone.",
          "expected_result": "Hoàn thành ma trận bảo vệ an toàn kỹ năng."
        },
        {
          "step_number": 5,
          "actor": "Architect",
          "action": "Xuất bản tệp blueprint.json và tự động kích hoạt schema_validator.py.",
          "expected_result": "blueprint.json được ghi thành công và validation schema đạt PASSED 100%."
        }
      ]
    }
  ],
  "interaction_points": [
    {
      "point_id": "IP-01",
      "stage": "architect",
      "description": "Dừng lại chờ người dùng (Steve) phê duyệt quy hoạch static_structure (danh sách tệp đề xuất) trước khi đi sâu vào sequence logic.",
      "require_user_approval": true
    },
    {
      "point_id": "IP-02",
      "stage": "architect",
      "description": "Chốt chặn chất lượng nghiệm thu toàn diện bản vẽ blueprint.json trước khi chuyển giao hạ nguồn.",
      "require_user_approval": true
    }
  ],
  "mitigation_map": [
    {
      "threat_id": "Prompt Injection",
      "implemented_in_zone": "core",
      "implementation_strategy": "Bọc toàn bộ dữ liệu thô đọc được vào thẻ XML strict boundaries và thiết lập Directive Separation cứng trong SKILL.md."
    }
  ]
}
